word,phonetic,definition_zh,definition_en,example,tags,audio_file
deputize,'dɛpjutaɪz,v  代理， 代表,to do the work of someone of a higher rank than you for a short time because they are unable to do it,The president said he could deputize the Florida National Guard to help with security.,sholvoir;gre;exam;core,
convince,kən'vɪns,v  使某人确信； 说服,to make someone feel certain that something is true,"Her arguments didn’t convince everyone, but changes were made.",sholvoir;gre;exam;core,
irritating,'iriteitiŋ,adj  刺激的； 使人愤怒的， 气人的,"an irritating habit, situation etc keeps annoying you",He’s the most irritating man I’ve ever met.,sholvoir;gre;exam;core,
stampede,stæm'pid,v  惊跑， 逃窜,,a herd of stampeding buffalo,sholvoir;gre;exam;core,
terminate,'tɝmɪnet,v  终止， 结束,"if something terminates, or if you terminate it, it ends",The court ruled that the contract must be terminated.,sholvoir;gre;exam;core,
inoffensive,",ɪnə'fɛnsɪv",adj  无害的； 不讨厌的,,"Her husband was a small, inoffensive-looking man.",sholvoir;gre;exam;core,
extension,ɪk'stɛnʃən,n  延伸， 扩展,"the process of making a road, building etc bigger or longer, or the part that is added",Donald’s been given an extension to finish his thesis.,sholvoir;gre;exam;core,
inappreciable,",ɪnə'priʃɪəbl",adj  微不足道的,,,sholvoir;gre;exam;core,
spanking,'spæŋkɪŋ,adj  强烈的； 疾行的,,,sholvoir;gre;exam;core,
architect,'ɑrkɪtɛkt,n  建筑师,someone whose job is to design buildings,James Madison was the principal architect of the constitution.,sholvoir;gre;exam;core,
duplicitous,djuːplɪsɪtəs,adj  两面派的， 奸诈的； 双重的,Someone who is duplicitous is deceitful,"He is a possessive, duplicitous, and unreasonable man.",sholvoir;gre;exam;core,
variability,",vɛrɪə'bɪləti",n  变化性,,"In our world, not only do we have variability, we've got unpredictability.",sholvoir;gre;exam;core,
stolid,'stɑlɪd,adj  无动于衷的,someone who is stolid does not react to situations or seem excited by them when most people would react – used to show disapproval,He conceals his feelings behind a rather stolid manner.,sholvoir;gre;exam;core,
boding,'bodɪŋ,adj  凶兆的， 先兆的; n 凶兆，前兆，预感,,,sholvoir;gre;exam;core,
lout,laʊt,n  蠢人， 笨蛋,,...a drunken lout.,sholvoir;gre;exam;core,
antagonistic,"æn,tæɡə'nɪstɪk",adj  敌对的， 对抗性的,unfriendly; wanting to argue or disagree,an antagonistic attitude,sholvoir;gre;exam;core,
mortgage,'mɔrɡɪdʒ,v  用…作抵押; n 抵押；抵押证书,"if you mortgage your home, land, or property, you borrow money, usually from a bank, and if you cannot pay back the money within a particular period of time, the bank has the right to sell your property in order to get the money you owe it; a legal arrangement by which you borrow money from a bank or similar organization in order to buy a house, and pay back the money over a period of years",We mortgaged our house to start Paul’s business.,sholvoir;gre;exam;core,
falsify,'fɔlsɪfaɪ,v  篡改； 说谎,"to change figures, records etc so that they contain false information",The file was altered to falsify the evidence.,sholvoir;gre;exam;core,
verify,'vɛrɪfaɪ,v  证明， 证实,to state that something is true,His statement was verified by several witnesses.,sholvoir;gre;exam;core,
snobbish,'snɑbɪʃ,adj  势利眼的； 假充绅士的,behaving in a way that shows you think you are better than other people because you are from a higher social class or know more than they do,Her family seems snobbish.,sholvoir;gre;exam;core,
inaugurate,ɪ'nɔɡjəret,v  举行就职典礼； 创始， 开创,to hold an official ceremony when someone starts doing an important job in government,The Turner Prize was inaugurated in 1984.,sholvoir;gre;exam;core,
plenitude,'plɛnɪtud,n  完全； 大量,a large amount of something,a plenitude of wealth,sholvoir;gre;exam;core,
solitude,'sɑlətud,n  孤独,"when you are alone, especially when this is what you enjoy",the solitude of her house on the lake,sholvoir;gre;exam;core,
reward,rɪ'wɔrd,v  酬谢， 奖赏; n 报酬，奖赏,to give something to someone because they have done something good or helpful or have worked for it; something that you get because you have done something good or helpful or have worked hard,The team have worked hard and their efforts have been rewarded with success.,sholvoir;gre;exam;core,
graze,ɡrez,v  吃草； 放牧,"if an animal grazes, or if you graze it, it eats grass that is growing",fields where they used to graze their sheep,sholvoir;gre;exam;core,
ebb,ɛb,v  退潮； 衰退,"if the tide ebbs, it flows away from the shore",Linda’s enthusiasm began to ebb away.,sholvoir;gre;exam;core,
pouch,paʊtʃ,v  使成袋状； 将装入袋内; n 小袋,"a small leather, cloth, or plastic bag that you can keep things in, and which is sometimes attached to a belt",a money pouch,sholvoir;gre;exam;core,
devout,dɪ'vaʊt,adj  虔诚的； 忠诚的， 忠心的,someone who is devout has a very strong belief in a religion,a devout Catholic,sholvoir;gre;exam;core,
comeuppance,kʌm'ʌpəns,n  应得的惩罚， 因果报应,a punishment or something bad which happens to you that you really deserve,You’ll get your comeuppance one day!,sholvoir;gre;exam;core,
distrait,di:s'tre,adj  心不在焉的,absent-minded; abstracted ,The distrait actress fluffed her lines.,sholvoir;gre;exam;core,
bawl,bɔl,v  大叫， 大喊,to shout in a loud voice,"‘Tickets, please!’ bawled the conductor.",sholvoir;gre;exam;core,
devour,dɪ'vaʊɚ,v  狼吞虎咽地吃， 吞食； 贪婪地看,to eat something quickly because you are very hungry,The boys devoured their pancakes.,sholvoir;gre;exam;core,
stir,stɝ,v  刺激,to make someone start doing something,"When a gust of wind blows over, the white yarn curl around, the deviation on the street water, stir spray.",sholvoir;gre;exam;core,
escort,ˈeskɔːrt,v  护送; n  护送者,"to take someone somewhere, especially when you are protecting or guarding them; a person or a group of people or vehicles that go with someone in order to protect or guard them",The shipment was escorted by guards.,sholvoir;gre;exam;core,
avarice,'ævərɪs,n  贪财， 贪婪,a desire to have a lot of money that is considered to be too strong,"He paid a month's rent in advance, just enough to satisfy the landlord's avarice.",sholvoir;gre;exam;core,
pretence,"pri'tens, 'pri:t-",n  假装； 借口,a way of behaving which is intended to make people believe something that is not true,It was all an elaborate pretence .,sholvoir;gre;exam;core,
termite,'tɝmaɪt,n  白蚁,an insect that eats and destroys wood from trees and buildings,"A German man and woman, their faces in close-up, talked about the good and essential symbiotic nature of termite mounds, with subtitles.",sholvoir;gre;exam;core,
libelous,'laɪbələs,adj  诽谤的,,"The chain says it has found upwards of 4,000 messages online containing libelous claims—including photos!",sholvoir;gre;exam;core,
maze,mez,n  迷宫,"a specially designed system of paths, often in a park or public garden, which is difficult to find your way through",We got completely lost in the maze.,sholvoir;gre;exam;core,
unqualified,",ʌn'kwɑlɪfaɪd",adj  无资格的， 不合格的； 无限制的， 绝对的,"not having the right knowledge, experience, or education to do something",unqualified staff,sholvoir;gre;exam;core,
thatch,θætʃ,v 以茅草覆盖; n  茅草屋顶； 茅草," straw  ,  reeds  , leaves etc used to make a roof, or the roof made of them",They would live in a small house with a green door and a new thatch.,sholvoir;gre;exam;core,
desolate,'dɛsələt,adj  荒凉的， 被遗弃的,a place that is desolate is empty and looks sad because there are no people there,a desolate landscape,sholvoir;gre;exam;core,
uproarious,ʌp'rɔrɪəs,adj  骚动的； 喧嚣的； 令人捧腹大笑的,"very noisy, because a lot of people are laughing or shouting",an uproarious party,sholvoir;gre;exam;core,
subdued,səb'dud,adj  柔和的， 缓和的； 温和的,"subdued lighting, colours etc are less bright than usual",Richard seems very subdued tonight.,sholvoir;gre;exam;core,
chicanery,ʃi'keinəri,n  欺骗， 欺诈,the use of clever plans or actions to deceive people,Clearly there is some chicanery going on.,sholvoir;gre;exam;core,
snooze,snuz,v  打盹儿， 打瞌睡,to sleep lightly for a short time,Dad was snoozing in his armchair.,sholvoir;gre;exam;core,
incongruent,ɪn'kɑŋgrʊənt,adj  不协调的， 不和谐的， 不合适的,,,sholvoir;gre;exam;core,
exaggerate,ɪɡ'zædʒəret,v  夸大， 夸张； 过分强调,"to make something seem better, larger, worse etc than it really is",I couldn’t sleep for three days – I’m not exaggerating.,sholvoir;gre;exam;core,
locution,lo'kjʊʃən,n  语言风格； 惯用语,"a phrase, especially one used in a particular area or by a particular group of people",,sholvoir;gre;exam;core,
demean,di'mi:n,v  贬抑， 降低,to do something that makes people lose respect for someone or something,language that demeans women,sholvoir;gre;exam;core,
gerontocracy,",dʒɛrən'tɑkrəsi",n  老人统治的政府,government by old people ,The phenomenon of gerontocracy has existed for millennia because the young are accustomed to following the aged.,sholvoir;gre;exam;core,
spell,spɛl,n  连续的一段时间,"a period of a particular kind of activity, weather, illness etc, usually a short period",a day of sunny spells and scattered showers,sholvoir;gre;exam;core,
vex,vɛks,v  使烦恼， 使恼怒,to make someone feel annoyed or worried,It vexed me to think of others gossiping behind my back.,sholvoir;gre;exam;core,
aberration,'æbə'reʃən,n  越轨,,,sholvoir;gre;exam;core,
cavity,'kævəti,n  洞， 腔,a hole or space inside something,Put herbs inside the body cavity of the fish.,sholvoir;gre;exam;core,
finicky,'fɪnɪki,adj  苛求的， 过分讲究的,too concerned with unimportant details and small things that you like or dislike,She’s very finicky about what she eats.,sholvoir;gre;exam;core,
provision,prə'vɪʒn,n  供应；条款,a condition in an agreement or law,The agreement includes a provision for each side to check the other side’s weapons.,sholvoir;gre;exam;core,
recruit,rɪ'krut,v  征募， 招募; n 新兵；新成员,"to get people to join the army, navy etc; someone who has just joined the army, navy, or  air force ",Most of the men in the village were recruited that day.,sholvoir;gre;exam;core,
thrust,θrʌst,v  猛力推； 刺， 戳,to push something somewhere roughly,She thrust a letter into my hand.,sholvoir;gre;exam;core,
demeanour,di'mi:nə,n  举止， 行为,"the way someone behaves, dresses, speaks etc that shows what their character is like","his quiet, reserved demeanour",sholvoir;gre;exam;core,
commence,kə'mɛns,v  开始， 着手,to begin or to start something,Work will commence on the new building immediately.,sholvoir;gre;exam;core,
sporadic,spə'rædɪk,adj  不定时发生的,"happening fairly often, but not regularly",There has been sporadic violence downtown.,sholvoir;gre;exam;core,
configuration,"kən,fɪɡjə'reʃən",n  结构， 配置； 轮廓,the combination of equipment needed to run a computer system,"Prices range from $119 to $199, depending on the particular configuration.",sholvoir;gre;exam;core,
spherical,'sfɪrɪkəl,adj  球的， 球状的,having the shape of a sphere,...purple and gold spherical earrings.,sholvoir;gre;exam;core,
pollster,'polstɚ,n  民意调查员,someone who works for a company that prepares and asks questions to find out what people think about a particular subject,"But Richard rival Hillary Clinton , but pollster Clay Richards says appears some in words inroads.",sholvoir;gre;exam;core,
enmity,'enməti,n  敌意， 仇恨,a feeling of hatred towards someone,I think there is an historic enmity between them.,sholvoir;gre;exam;core,
provenance,'prɑvənəns,n  出处， 起源,the place where something originally came from,The provenance of the paintings is unknown.,sholvoir;gre;exam;core,
extinct,ɪk'stɪŋkt,adj  绝种的， 不存在的,an extinct type of animal or plant does not exist any more,Dinosaurs have been extinct for millions of years.,sholvoir;gre;exam;core,
monolithic,",mɑnə'lɪθɪk",adj  坚若磐石的； 巨大的,"a monolithic building is very large, solid, and impressive",a monolithic movie company,sholvoir;gre;exam;core,
martyr,'mɑrtɚ,n  烈士， 殉道者,someone who dies for their religious or political beliefs and is admired by people for this,"St. Stephen, the first Christian martyr",sholvoir;gre;exam;core,
opaque,o'pek,adj  不透明的； 难懂的,opaque glass or liquid is difficult to see through and often thick,a shower with an opaque glass door,sholvoir;gre;exam;core,
grave,ɡrev,adj 严肃的，庄重的; n  墓穴,"grave problems, situations, or worries are very great or bad; the place in the ground where a dead body is buried",Matthew’s life is in grave danger .,sholvoir;gre;exam;core,
advantage,əd'væntɪdʒ,v  有利于， 有益于; n 利益，益处,,Younger workers tend to be at an advantage (=  have an advantage  ) when applying for jobs.,sholvoir;gre;exam;core,
tepid,'tɛpɪd,adj  微温的； 不热情的,"a feeling, reaction etc that is tepid shows a lack of excitement or interest",a tepid response from the audience,sholvoir;gre;exam;core,
improvident,ɪm'prɑvədənt,adj  无远见的， 不节俭的,too careless to save any money or to plan for the future,,sholvoir;gre;exam;core,
embolden,ɛm'boldən,v  鼓励,,,sholvoir;gre;exam;core,
abortive,ə'bɔrtɪv,adj  无结果的， 失败的,an abortive action is not successful,an abortive military coup,sholvoir;gre;exam;core,
far-reaching,'fɑ:'ri:tʃiŋ,adj  影响深远的,having a great influence or effect,The economy is in danger of collapse unless far-reaching reforms are implemented.,sholvoir;gre;exam;core,
mordant,'mɔrdnt,adj  讥讽的， 尖酸的,unkind and insulting humour etc that is also funny,The play’s mordant comedy makes for compelling viewing.,sholvoir;gre;exam;core,
anticipate,æn'tɪsə'pet,v  预先处理； 预期， 期望,to expect that something will happen and be ready for it,Sales are better than anticipated.,sholvoir;gre;exam;core,
fabricate,'fæbrɪket,v  捏造； 制造,"to invent a story, piece of information etc in order to deceive someone",The police were accused of fabricating evidence.,sholvoir;gre;exam;core,
bullion,'bʊlɪən,n  金条， 银条,bars of gold or silver,gold bullion,sholvoir;gre;exam;core,
temporary,ˈtempəreri,adj  暂时的， 临时的,continuing for only a limited period of time,temporary pain relief,sholvoir;gre;exam;core,
habitat,'hæbə'tæt,n  自然环境， 栖息地,the natural home of a plant or animal,watching monkeys in their natural habitat,sholvoir;gre;exam;core,
optimal,'ɑptəml,adj  最佳的， 最理想的,the best or most suitable,"However, if you want optimal shadow quality and performance, there are some additional things to consider.",sholvoir;gre;exam;core,
hardheaded,'hɑ:d'hedid,adj  讲究实际的， 冷静的， 精明的,,...a hardheaded and shrewd businesswoman.,sholvoir;gre;exam;core,
sacrament,'sækrəmənt,n  圣礼， 圣事,the bread and wine that are eaten at  communion (= an important Christian ceremony ) ,...the holy sacrament of baptism.,sholvoir;gre;exam;core,
frothy,'frɔθi,adj  起泡的； 空洞的,a liquid that is frothy has lots of small  bubbles  on top,a mug of frothy coffee,sholvoir;gre;exam;core,
self-righteousness,ˌself'raɪtʃəsnəs,n  自以为是,,,sholvoir;gre;exam;core,
anguish,'æŋɡwɪʃ,n  极大的痛苦,mental or physical suffering caused by extreme pain or worry,the anguish of not knowing what had happened to her,sholvoir;gre;exam;core,
chimera,kaɪ'mɪrə,n  神话怪物； 梦幻,A chimera is an unrealistic idea that you have about something or a hope that you have that is unlikely to be fulfilled,Religious unity remained as much a chimera as ever.,sholvoir;gre;exam;core,
vie,vaɪ,v  竞争,to compete very hard with someone in order to get something,California is vying with other states to capture a piece of the growing communications market.,sholvoir;gre;exam;core,
refraction,rɪ'frækʃən,n  折射,,The sonobuoy permits recording a refraction profile with only one ship.,sholvoir;gre;exam;core,
enclosure,ɪn'kloʒɚ,n  圈地， 围场,"an area surrounded by a wall or fence, and used for a particular purpose",the bear enclosure at the zoo,sholvoir;gre;exam;core,
absent,ˈæbsnt;(for v.)əbˈsɛnt,v 缺席，不参加away); adj  缺席的,"to not go to a place or take part in an event where people expect you to be; not at work, school, a meeting etc, because you are sick or decide not to go",He has been absent from his desk for two weeks.,sholvoir;gre;exam;core,
emasculate,ɪ'mæskjʊlɪt,v 使柔弱；阉割; adj  柔弱的,to remove all or part of a male’s sex organs,The bill has been emasculated by Congress.,sholvoir;gre;exam;core,
ragged,'ræɡɪd,adj  褴褛的， 破烂的,torn and in bad condition,the ragged blankets on the bed,sholvoir;gre;exam;core,
sanctuary,'sæŋktʃuɛri,n  圣地； 庇护所， 避难所； 庇护,"a peaceful place that is safe and provides protection, especially for people who are in danger",His church became a sanctuary for thousands of people who fled the civil war.,sholvoir;gre;exam;core,
snobbery,'snɑbəri,n  势利,"behaviour or attitudes which show that you think you are better than other people, because you belong to a higher social class or know much more than they do – used to show disapproval","{""COLLOINEXA"":[""intellectual snobbery""]}",sholvoir;gre;exam;core,
conundrum,kə'nʌndrəm,n  谜语； 难题,a confusing and difficult problem,the conundrum of our purpose on Earth,sholvoir;gre;exam;core,
inspired,ɪn'spaɪrd,adj  有创见的， 有灵感的,,an inspired leader,sholvoir;gre;exam;core,
economy,ɪˈkɑnəmɪ,adj  经济的; n 节约；经济,"a product that is cheaper because you are buying a larger amount; the system by which a country’s money and goods are produced and used, or a country considered in this way",...the limitations that come with economy travel.,sholvoir;gre;exam;core,
interdisciplinary,",ɪntɚ'dɪsəplɪnɛri",adj  跨学科的,"involving ideas, information, or people from different subjects or areas of study",an interdisciplinary research centre,sholvoir;gre;exam;core,
staunch,stɔntʃ,adj  坚定的， 忠诚的,"giving strong loyal support to another person, organization, belief etc",a staunch conservative,sholvoir;gre;exam;core,
coeval,ko'ivl,adj  同时代的,of or belonging to the same age or generation ,"The coeval of sushi afterwards and personage began to spread the creation form of ""he tao shi"".",sholvoir;gre;exam;core,
orchard,'ɔrtʃɚd,n  果园,a place where fruit trees are grown,a cherry orchard,sholvoir;gre;exam;core,
heartfelt,'hɑrtfɛlt,adj  衷心的， 诚挚的,very strongly felt and sincere,a heartfelt apology,sholvoir;gre;exam;core,
pilfer,'pilfə,v  偷窃,"to steal things that are not worth much, especially from the place where you work",The staff were pilfering behind the bar.,sholvoir;gre;exam;core,
notch,nɑtʃ,n  V字形切口， 刻痕； 等级， 档次,"a level on a scale that measures something, for example quality or achievement",Her new book is several notches above anything else she has written.,sholvoir;gre;exam;core,
despotic,dɪ'spɑtɪk,adj  专横的， 暴虐的,"If you say that someone is despotic, you are emphasizing that they use their power over other people in a very unfair or cruel way",The country was ruled by a despotic tyrant.,sholvoir;gre;exam;core,
discomfit,dɪs'kʌmfɪt,v  使难堪， 使困惑,"If you are discomfited by something, it causes you to feel slightly embarrassed or confused",He will be particularly discomfited by the governor's dismissal of his plan.,sholvoir;gre;exam;core,
vista,'vɪstə,n  远景； 展望,"the possibility of new experiences, ideas, events etc",Exchange programs open up new vistas for students.,sholvoir;gre;exam;core,
insoluble,ɪn'sɑljəbl,adj  不能溶解的； 不能解决的,an insoluble problem is or seems impossible to solve,insoluble conflicts within the department,sholvoir;gre;exam;core,
appropriate,əˈproprɪət;(for v.) əˈproprɪet,v 拨款；盗用; adj  恰当的,"to take something for yourself when you do not have the right to do this; correct or suitable for a particular time, situation, or purpose",He is suspected of appropriating government funds.,sholvoir;gre;exam;core,
exhale,ɛks'hel,v  呼出； 呼气； 散发,"to breathe air, smoke etc out of your mouth","Take a deep breath, then exhale slowly.",sholvoir;gre;exam;core,
resignation,",rɛzɪɡ'neʃən",n  听从， 顺从； 辞职,"when someone calmly accepts a situation that cannot be changed, even though it is bad",She gave a sigh of resignation.,sholvoir;gre;exam;core,
cede,sid,v  割让， 放弃,"to give something such as an area of land or a right to a country or person, especially when you are forced to","Only a short campaign took place in Puerto Rico, but after the war Spain ceded the island to America.",sholvoir;gre;exam;core,
shiftless,'ʃɪftləs,adj  没出息的， 懒惰的； 无能的,lazy and having no interest in working hard or trying to succeed,...a shiftless husband.,sholvoir;gre;exam;core,
clannish,'klænɪʃ,adj  排他的， 门户之见的,"a group of people who are clannish are very close to each other, and seem unfriendly towards strangers",a clannish community,sholvoir;gre;exam;core,
misrepresentation,",mɪsrɛprɪzɛn'teʃən",n  误传， 不实的陈述,,,sholvoir;gre;exam;core,
typify,'tɪpɪfaɪ,v  代表， 是…的典型,to be a typical example of something,the features which typify a Scottish Highland landscape,sholvoir;gre;exam;core,
perceptive,pɚ'sɛptɪv,adj  感知的， 知觉的； 有洞察力的， 敏锐的,"someone who is perceptive notices things quickly and understands situations, people’s feelings etc well – used to show approval",a perceptive young man,sholvoir;gre;exam;core,
stagnant,'stægnənt,adj  停滞的,"not changing or making progress, and continuing to be in a bad condition",a government plan to revive the stagnant economy,sholvoir;gre;exam;core,
cultivated,'kʌltɪvetɪd,adj  耕种的， 栽培的； 有教养的 having or showing good taste and refinement),"someone who is cultivated is intelligent and knows a lot about music, art, literature etc",a highly cultivated man,sholvoir;gre;exam;core,
density,'dɛnsəti,n  密集， 稠密,the degree to which an area is filled with people or things,areas of high population density,sholvoir;gre;exam;core,
dreary,'drɪri,adj  沉闷的， 乏味的,dull and making you feel sad or bored,the same dreary routine,sholvoir;gre;exam;core,
stunt,stʌnt,v 阻碍; n  特技， 绝技,"to stop something or someone from growing to their full size or developing properly; a dangerous action that is done to entertain people, especially in a film",Lack of sunlight will stunt the plant’s growth.,sholvoir;gre;exam;core,
characterize,'kærəktə'raɪz,v  表现…的特色， 刻画…的性格,to describe the qualities of someone or something in a particular way,Bright colours characterize his paintings.,sholvoir;gre;exam;core,
ridiculous,rɪ'dɪkjələs,adj  荒谬的， 可笑的,very silly or unreasonable,That’s a ridiculous idea!,sholvoir;gre;exam;core,
severe,səˈvɪr,adj  严厉的； 剧烈的,"severe problems, injuries, illnesses etc are very bad or very serious",His injuries were quite severe.,sholvoir;gre;exam;core,
monopolize,mə'nɑpə'laɪz,v  垄断， 独占,to have complete control over something so that other people cannot share it or take part in it,The company has monopolized the soft drinks market.,sholvoir;gre;exam;core,
lease,lis,v  出租; n 租约；租期,"to use a building, car etc under a lease; a legal agreement which allows you to use a building, car etc for a period of time, in return for rent",I’m interested in leasing your cottage.,sholvoir;gre;exam;core,
exploit,ɛksplɔɪt; ɪkˈsplɔɪt,v  剥削； 充分利用; n  英勇行为,"to treat someone unfairly by asking them to do things for you, but giving them very little in return – used to show disapproval; a brave and exciting adventure that someone has had",Homeworkers can easily be exploited by employers.,sholvoir;gre;exam;core,
sprint,sprɪnt,v  短距离全速奔跑,to run very fast for a short distance,Sergeant Horne sprinted to the car.,sholvoir;gre;exam;core,
errand,'ɛrənd,n  差使； 差事,"a short journey in order to do something for someone, for example delivering or collecting something for them",I seemed to spend my life running errands for people.,sholvoir;gre;exam;core,
flamboyant,flæm'bɔɪənt,adj  艳丽的， 显眼的， 炫耀的,behaving in a confident or exciting way that makes people notice you,He lifted his arms in a flamboyant gesture .,sholvoir;gre;exam;core,
entangle,ɪn'tæŋɡl,v  使卷入,"to involve someone in an argument, a relationship, or a situation that is difficult to escape from",Bureaucracy can entangle applications for months.,sholvoir;gre;exam;core,
amity,'æməti,n  友好关系,"friendship, especially between countries",a spirit of perfect amity,sholvoir;gre;exam;core,
garnish,'gɑrnɪʃ,v  装饰,to add something to food in order to decorate it,She had finished the vegetables and was garnishing the roast.,sholvoir;gre;exam;core,
repellent,rɪ'pɛlənt,adj  令人厌恶的,very unpleasant,She found him physically repellent.,sholvoir;gre;exam;core,
