word,phonetic,definition_zh,definition_en,example,tags,audio_file
hale,heɪl,adj  健壮的， 矍铄的,"someone, especially an old person, who is hale and hearty is very healthy and active",She’s still hale and hearty at 74.,sholvoir;gre;exam;core,
belligerent,bi'lidʒərənt,adj  发动战争的； 好斗的， 好挑衅的,very unfriendly and wanting to argue or fight,a belligerent attitude,sholvoir;gre;exam;core,
supplant,sə'plænt,v  排挤， 取代,"to take the place of a person or thing so that they are no longer used, no longer in a position of power etc",Barker was soon supplanted as party leader.,sholvoir;gre;exam;core,
abrupt,ə'brʌpt,adj  突然的， 意外的； 唐突的,sudden and unexpected,an abrupt change of plan,sholvoir;gre;exam;core,
predispose,'pridɪ'spoz,v  使预先有倾向； 易受感染,to make someone more likely to suffer from a particular health problem,They take pains to hire people whose personalities predispose them to serve customers well.,sholvoir;gre;exam;core,
spontaneous,spɑn'tenɪəs,adj  自发的； 自然的,"something that is spontaneous has not been planned or organized, but happens by itself, or because you suddenly feel you want to do it",The crowd gave a spontaneous cheer.,sholvoir;gre;exam;core,
blameworthy,'blemwɝði,adj  该责备的， 有过失的,deserving blame or disapproval,blameworthy conduct,sholvoir;gre;exam;core,
gloomy,'ɡlumi,adj  阴暗的； 没有希望的； 阴郁的， 忧郁的,sad because you think the situation will not improve,Anne dismissed these gloomy thoughts from her mind.,sholvoir;gre;exam;core,
deference,'dɛfərəns,n  敬意， 尊重,polite behaviour that shows that you respect someone and are therefore willing to accept their opinions or judgment,...the older political tradition of deference to great leaders.,sholvoir;gre;exam;core,
compassionate,kəm'pæʃənət,adj  有同情心的,feeling sympathy for people who are suffering,"a caring, compassionate man",sholvoir;gre;exam;core,
other-directed,'ʌðədi'rektid,adj  受人支配的,,Pisces is a water element. ruled by mystical neptune this sign is extremely receptive compassionate and other-directed .,sholvoir;gre;exam;core,
protective,prə'tɛktɪv,adj  保护的， 防护的,used or intended for protection,protective clothing,sholvoir;gre;exam;core,
grandiloquence,græn'dɪləkwəns,n  豪言壮语， 夸张之言,,A hero is more than one hundred times grandiloquence! ! ! ! !,sholvoir;gre;exam;core,
bogus,'bogəs,adj  伪造的， 假的,"not true or real, although someone is trying to make you think it is",bogus insurance claims,sholvoir;gre;exam;core,
flit,flɪt,v  掠过， 迅速飞过,,Birds flitted about in the trees above them.,sholvoir;gre;exam;core,
indigence,"'indidʒəns,-dʒənsi",n  贫穷， 贫困,,"For one of the poets has said, 'Application to business is the root of prosperity, but those who ask questions that do not concern them are steering the ship of folly towards the rock of indigence'.",sholvoir;gre;exam;core,
vengeance,'vɛndʒəns,n  报仇， 报复,a violent or harmful action that someone does to punish someone for harming them or their family,a desire for vengeance,sholvoir;gre;exam;core,
authenticate,ɔ'θɛntɪket,v  证明…是真实的,to prove that something is true or real,The painting has been authenticated by experts.,sholvoir;gre;exam;core,
concede,kən'sid,v  承认； 让步,"to admit that something is true or correct, although you wish it were not true","‘That’s the only possible solution.’ ‘Yes, I suppose so,’ Charles conceded.",sholvoir;gre;exam;core,
grumpy,'ɡrʌmpi,adj  脾气暴躁的,bad-tempered and easily annoyed,Mina’s always a bit grumpy first thing in the morning.,sholvoir;gre;exam;core,
reprimand,'rɛprɪmænd,v  训诫， 谴责; n 训诫，谴责,to tell someone officially that something they have done is very wrong; Reprimand is also a noun,He was reprimanded by a teacher for talking in the corridor.,sholvoir;gre;exam;core,
transitional,træn'zɪʃənl,adj  转变的， 变迁的,,We live in the transitional age between that decision and its conclusion.,sholvoir;gre;exam;core,
wreak,rik,v  发泄， 报复； 发泄怒火,to do something unpleasant to someone to punish them for something they have done to you,He promised to wreak vengeance on those who had betrayed him.,sholvoir;gre;exam;core,
commission,kə'mɪʃən,n  委托； 佣金,an extra amount of money that is paid to a person or organization according to the value of the goods they have sold or the services they have provided,The dealer takes a 20% commission on the sales he makes.,sholvoir;gre;exam;core,
flip,flɪp,v 用指轻弹；蹦蹦跳跳; adj  无礼的； 冒失的； 轻率的,not said or meant seriously,I was fed up with his flip comments.,sholvoir;gre;exam;core,
nibble,'nɪbl,v  一点点地咬， 慢慢啃,to eat small amounts of food by taking very small bites,He nibbled the biscuit cautiously.,sholvoir;gre;exam;core,
rescind,rɪ'sɪnd,v  废除， 取消,"to officially end a law, or change a decision or agreement",The governor does not have the authority to rescind the ruling.,sholvoir;gre;exam;core,
resume,rɪ'zuːm,v  重新开始， 继续,to start doing something again after stopping or being interrupted,She hopes to resume work after the baby is born.,sholvoir;gre;exam;core,
tatter,'tætə,v  撕碎; n 碎片,"to make or become ragged or worn to shreds ; torn or ragged pieces, esp of material ",,sholvoir;gre;exam;core,
spiral,'spaɪrəl,adj 螺旋形的；上升的; v  螺旋式上升或下降,Spiral is also an adjective; to move in a continuous curve that gets nearer to or further from its central point as it goes round,...a spiral staircase.,sholvoir;gre;exam;core,
pied,paɪd,adj  杂色的,used in the names of birds that are black and white,a pied wagtail,sholvoir;gre;exam;core,
effrontery,ɪ'frʌntrɪ,n  厚颜无耻； 放肆,rude behaviour that shocks you because it is so confident,The man had the effrontery to be sarcastic.,sholvoir;gre;exam;core,
gripping,'grɪpɪŋ,adj  吸引注意力的， 扣人心弦的,"a gripping film, story etc is very exciting and interesting",Collins’ gripping detective novel,sholvoir;gre;exam;core,
stasis,'stesɪs,n  停滞,a state or period in which there is no change or development,Rock 'n' roll had entered a period of stasis.,sholvoir;gre;exam;core,
obvious,'ɑbvɪəs,adj  明显的， 显而易见的,easy to notice or understand,The obvious way of reducing pollution is to use cars less.,sholvoir;gre;exam;core,
dogged,'dɔɡɪd,adj  顽强的,dogged behaviour shows that you are very determined to continue doing something,a dogged determination to succeed,sholvoir;gre;exam;core,
earthy,'ɝθi,adj  粗俗的， 土气的,"tasting, smelling, or looking like earth or soil",earthy colours,sholvoir;gre;exam;core,
undulate,'ʌndʒə'let,v  波动， 起伏,to move or be shaped like waves that are rising and falling,undulating hills,sholvoir;gre;exam;core,
obese,o'bis,adj  极胖的,very fat in a way that is unhealthy,Obese people tend to have higher blood pressure than lean people.,sholvoir;gre;exam;core,
empty,ˈɛmptɪ,adj 空的，缺乏的; v  变空， 把…弄空,having nothing inside; to remove everything that is inside something,an empty box,sholvoir;gre;exam;core,
goof,ɡuf,v  犯错误； 闲逛， 消磨时间,to make a silly mistake,Somebody goofed and entered the wrong amount.,sholvoir;gre;exam;core,
beatific,",biə'tɪfɪk",adj  幸福的， 快乐的,"a beatific look, smile etc shows great peace and happiness",...a beatific smile.,sholvoir;gre;exam;core,
deploy,dɪ'plɔɪ,v  部署； 拉长， 展开 especially in width,"to organize or move soldiers, military equipment etc so that they are in the right place and ready to be used",The president said he had no intention of deploying ground troops.,sholvoir;gre;exam;core,
huddle,'hʌdl,v 挤成一团; n  一堆人,"if a group of people huddle together, they stay very close to each other, especially because they are cold or frightened; a group of people or things that are close together, but not arranged in any particular order, pattern, or system",We lay huddled together for warmth.,sholvoir;gre;exam;core,
tie,taɪ,v  系， 拴， 绑; n 平局，不分胜负,"to fasten things together or hold them in a particular position using a piece of string, rope etc; the result of a game, competition, or election when two or more people or teams get the same number of points, votes etc",I tie my hair back when I’m jogging.,sholvoir;gre;exam;core,
rendition,rɛn'dɪʃən,n  表演， 演唱,"someone’s performance of a play, piece of music etc",He gave a moving rendition of Lennon’s ‘Imagine’.,sholvoir;gre;exam;core,
gumption,'ɡʌmpʃən,n  进取心， 魄力； 精明强干,the ability and determination to decide what needs to be done and to do it,At least she had the gumption to phone me.,sholvoir;gre;exam;core,
myriad,'miriəd,adj  许多的， 无数的,very many,the myriad causes of homelessness,sholvoir;gre;exam;core,
tattle,'tætl,v  闲聊； 泄露秘密,,...instruct our children not to tattle on one another.,sholvoir;gre;exam;core,
disperse,dɪ'spɝs,v  消散， 驱散,"if a group of people disperse or are dispersed, they go away in different directions",Police used tear gas to disperse the crowd.,sholvoir;gre;exam;core,
erratic,ɪ'rætɪk,adj  无规律的， 不稳定的； 古怪的,something that is erratic does not follow any pattern or plan but happens in a way that is not regular,His breathing was becoming erratic.,sholvoir;gre;exam;core,
adoration,",ædə'reʃən",n  崇拜， 爱慕,great love and admiration,the look of adoration in his eyes,sholvoir;gre;exam;core,
cinder,'sɪndɚ,n  余烬， 煤渣,"a very small piece of burnt wood, coal etc",a cold hearth full of cinders,sholvoir;gre;exam;core,
fantasy,'fæntəsi,n  想象， 幻想,"an exciting and unusual experience or situation you imagine happening to you, but which will probably never happen",I used to have fantasies about living in Paris with an artist.,sholvoir;gre;exam;core,
erode,ɪ'rod,v  侵蚀； 受到侵蚀,"if the weather erodes rock or soil, or if rock or soil erodes, its surface is gradually destroyed",The cliffs are being constantly eroded by heavy seas.,sholvoir;gre;exam;core,
informative,ɪn'fɔrmətɪv,adj  提供信息的； 见闻广博的,Something that is informative gives you useful information,Both men termed the meeting friendly and informative.,sholvoir;gre;exam;core,
tusk,tʌsk,n  长牙,"one of a pair of very long pointed teeth, that stick out of the mouth of animals such as  elephants ",A huge tusk decorated the wall of his study.,sholvoir;gre;exam;core,
sane,sen,adj  神志清楚的； 明智的,able to think in a normal and reasonable way,He seems perfectly sane (= completely sane ) to me.,sholvoir;gre;exam;core,
frustrate,'frʌstret,v  挫败， 使沮丧,"if something frustrates you, it makes you feel annoyed or angry because you are unable to do what you want",The fact that he’s working with amateurs really frustrates him.,sholvoir;gre;exam;core,
jounce,dʒaʊns,v  颠簸地移动,,,sholvoir;gre;exam;core,
gorgeous,'ɡɔrdʒəs,adj  华丽的； 极好的,extremely beautiful or attractive,‘What do you think of my new flatmate?’ ‘He’s absolutely gorgeous !’,sholvoir;gre;exam;core,
importune,",ɪmpɔr'tun",v  强求， 胡搅蛮缠,"If someone importunes another person, they ask them for something or ask them to do something, in an annoying way",One can no longer walk the streets without seeing beggars importuning passersby.,sholvoir;gre;exam;core,
wacky,'wæki,adj  古怪的， 乖僻的,silly in an exciting or amusing way,a wonderfully wacky idea,sholvoir;gre;exam;core,
harp,hɑrp,v  弹竖琴； 喋喋不休地说或写; n 竖琴,"a large musical instrument with strings that are stretched across a vertical frame with three corners, and that you play with your fingers",He played an Irish melody on the harp.,sholvoir;gre;exam;core,
inmate,'ɪnmet,n  同住者， 同居者,,...education for prison inmates.,sholvoir;gre;exam;core,
fickleness,'fɪkəlnəs,n  浮躁； 变化无常,,His story became a parable for the fickleness of art and life.,sholvoir;gre;exam;core,
embody,ɪm'bɑdi,v  使具体化， 体现,to be a very good example of an idea or quality,She embodies everything I admire in a teacher.,sholvoir;gre;exam;core,
regale,rɪ'ɡel,v  款待， 宴请； 使…快乐,,,sholvoir;gre;exam;core,
welter,'wɛltɚ,n  混乱， 杂乱无章,a large and confusing amount or number of something,There is a welter of information on the subject.,sholvoir;gre;exam;core,
muster,'mʌstɚ,v  召集， 聚集,"if soldiers muster, or if someone musters them, they come together in a group","In April 1185, he began to muster an army .",sholvoir;gre;exam;core,
verifiable,"'vɛrə,faɪəbl",adj  能作证的,Something that is verifiable can be proved to be true or genuine,This is not a romantic notion but verifiable fact.,sholvoir;gre;exam;core,
ascent,ə'sɛnt,n  上升， 攀登； 上坡路； 提高， 提升,the act of climbing something or moving upwards,the first ascent of Qomolangma,sholvoir;gre;exam;core,
comprehensible,'kɑmprɪ'hɛnsəbl,adj  可理解的， 易于理解的,easy to understand,Her speech was slurred and barely comprehensible.,sholvoir;gre;exam;core,
motivate,'motə'vet,v  激发， 刺激,to make someone want to achieve something and make them willing to work hard in order to do this,A good teacher has to be able to motivate her students.,sholvoir;gre;exam;core,
projection,prə'dʒɛkʃən,n  突起物， 隆起物； 设计， 规划； 发射， 投射,the act of imagining that someone else is feeling the same emotions as you,projection equipment,sholvoir;gre;exam;core,
dissident,'dɪsɪdənt,n  唱反调者,,,sholvoir;gre;exam;core,
multiply,'mʌltɪplaɪ,v  乘； 增加； 繁殖,to breed,Bacteria multiply quickly in warm food.,sholvoir;gre;exam;core,
fluffy,'flʌfi,adj  有绒毛的； 无聊的， 琐碎的,,a fluffy little kitten,sholvoir;gre;exam;core,
immolate,'ɪməlet,v  牺牲， 献祭,,He would immolate himself for their noble cause .,sholvoir;gre;exam;core,
hauteur,əu'tə:,n  傲慢,"a proud, very unfriendly manner","Once, she had been put off by his hauteur.",sholvoir;gre;exam;core,
hedonist,'hidənɪst,n  享乐主义者,someone who believes that pleasure is the most important thing in life,"He is at once a hedonist who preaches prudence and temperance, a theist who rejects divine intervention and the survival of the soul, and an atomist who upholds both mechanism and free will.",sholvoir;gre;exam;core,
hypochondriac,",haɪpə'kɑndrɪæk",adj  忧郁症的; n 忧郁症患者,"someone who always worries about their health and thinks they may be ill, even when they are really not ill","Sian: Exactly, this term is a combination of 'cyber' — relating to computers — and hypochondriac.",sholvoir;gre;exam;core,
conducive,kən'dusɪv,adj  有助于…的， 有益的,"if a situation is conducive to something such as work, rest etc, it provides conditions that make it easy for you to work etc",an environment conducive to learning,sholvoir;gre;exam;core,
iridescent,",ɪrɪ'dɛsnt",adj  色彩斑斓的,showing colours that seem to change in different lights,small iridescent blue flies,sholvoir;gre;exam;core,
multiple,'mʌltəpl,adj  多样的， 多重的,"many, or involving many things, people, events etc",Baxter was rushed to the hospital with multiple stab wounds.,sholvoir;gre;exam;core,
chaffing,'tʃæfɪŋ,adj  玩笑的， 嘲弄的,,,sholvoir;gre;exam;core,
requite,rɪ'kwaɪt,v  报答； 报复,to give or do something in return for something done or given to you,I represent all of the children to guarantee : we 'll study hard to requite you !,sholvoir;gre;exam;core,
haggard,'hæɡɚd,adj  憔悴的， 消瘦的,"someone who looks haggard has lines on their face and dark marks around their eyes, especially because they are ill, worried, or tired",Sam looked tired and haggard.,sholvoir;gre;exam;core,
poignant,'pɔɪnjənt,adj  令人痛苦的， 伤心的； 尖锐的， 尖刻的,making you feel sad or full of pity,,sholvoir;gre;exam;core,
puncture,'pʌŋktʃɚ,v 刺穿，戳破; n  刺孔， 穿孔,"if a tyre punctures, or if you puncture it, a small hole appears in it; a small hole made by a sharp point, especially in someone’s body",A piece of glass punctured the back tyre.,sholvoir;gre;exam;core,
omnivorous,ɑm'nɪvərəs,adj  杂食的； 兴趣杂的,an animal that is omnivorous eats both meat and plants,an omnivorous reader,sholvoir;gre;exam;core,
foolproof,'fulpruf,adj  极易懂的， 十分简单的,,a foolproof way of preventing credit card fraud,sholvoir;gre;exam;core,
taking,'tekɪŋ,adj  楚楚动人的， 迷人的,"charming, fascinating, or intriguing ",,sholvoir;gre;exam;core,
terrifying,ˈtɛrəˌfaɪɪŋ,adj  恐怖的,"If something is terrifying, it makes you very frightened",I still find it terrifying to find myself surrounded by large numbers of horses.,sholvoir;gre;exam;core,
romance,ro'mæns,v  虚构; n 传奇故事；虚构；浪漫氛围；风流韵事,an exciting and often short relationship between two people who love each other,Michelle married him after a whirlwind romance (= one that happens very suddenly and quickly ) .,sholvoir;gre;exam;core,
impeach,ɪm'pitʃ,v  控告； 怀疑； 弹劾,"if a government official is impeached, they are formally charged with a serious crime in a special government court",The governor was impeached for using state funds improperly.,sholvoir;gre;exam;core,
artistry,'ɑrtɪstri,n  艺术技巧,skill in a particular artistic activity,the artistry of dance,sholvoir;gre;exam;core,
catalog,'kætəlɔg,n  目录； 系列,,Can you catalog all these books?,sholvoir;gre;exam;core,
immortal,ɪ'mɔrtl,adj  不朽的， 流芳百世的,living or continuing for ever,Plato believed that the soul is immortal.,sholvoir;gre;exam;core,
narcissist,nɑr'sɪsɪst,n  自恋狂， 自恋者,,"Sister Hibiscus says things as if she is living in a romance novel. Many call her a narcissist, but she prefers the term ""self- confidence. """"",sholvoir;gre;exam;core,
sate,set,v  使心满意足， 使厌腻,to satisfy (a desire or appetite) fully ,,sholvoir;gre;exam;core,
conjecture,kən'dʒɛktʃɚ,v&n  推测， 臆测,when you form ideas or opinions without having very much information to base them on,What she said was pure conjecture .,sholvoir;gre;exam;core,
burlesque,bɝ'lɛsk,n  讽刺或滑稽的戏剧， 滑稽剧,"speech, acting, or writing in which a serious subject is made to seem silly or an unimportant subject is treated in a serious way",The book read like a black comic burlesque.,sholvoir;gre;exam;core,
sash,sæʃ,n  肩带,a long piece of cloth that you wear around your waist like a belt,She wore a white dress with a thin blue sash.,sholvoir;gre;exam;core,
carrion,'kærɪən,n  腐肉,"the decaying flesh of dead animals, which is eaten by some animals and birds",They range widely in search of carrion.,sholvoir;gre;exam;core,
conceit,kən'sit,n  自负， 自大,an attitude that shows you have too high an opinion of your own abilities or importance,The conceit of the woman!,sholvoir;gre;exam;core,
indelible,ɪn'dɛləbl,adj  擦拭不掉的， 不可磨灭的,Indelible ink or an indelible stain cannot be removed or washed out,It leaves indelible stains on clothes.,sholvoir;gre;exam;core,
timid,'tɪmɪd,adj  羞怯的； 胆怯的， 怯懦的,not having courage or confidence,I was a timid child.,sholvoir;gre;exam;core,
decentralize,di'sɛntrə'laɪz,v  分散， 权力下放 from central government to regional government),"to move parts of a government, organization etc from a central place to several different smaller ones",Many firms are decentralizing their operations.,sholvoir;gre;exam;core,
phobia,'fobɪə,n  恐惧症,a strong unreasonable fear of something,Some children suffer from school phobia .,sholvoir;gre;exam;core,
angular,'æŋɡjəlɚ,adj  生硬的， 笨拙的； 有角的； 瘦削的,having sharp and definite corners,a cubist painting with angular shapes,sholvoir;gre;exam;core,
remit,'rimɪt,v  免除； 宽恕； 汇款,to send a payment,Please remit payment by cheque.,sholvoir;gre;exam;core,
fallow,'fælo,adj  休耕的; n 休耕地,fallow land is dug or  ploughed  but is not used for growing crops; land treated in this way ,They let the land lie fallow for a year.,sholvoir;gre;exam;core,
assuredness,ə'ʃurdnəs,n  确定； 自信,,Say it with assuredness.,sholvoir;gre;exam;core,
podium,'podɪəm,n  讲坛， 指挥台,"a small raised area for a performer, speaker, or musical  conductor  to stand on","Unsteadily he mounted the podium, adjusted the microphone, coughed, and went completely blank.",sholvoir;gre;exam;core,
ensue,ɪn'su,v  接着发生,to happen after or as a result of something,"If the Europeans did not reduce subsidies, a trade war would ensue.",sholvoir;gre;exam;core,
weightless,'wetləs,adj  无重力的， 失重的,"something that is weightless seems to have no weight, especially when it is floating in space or water",Photons have no mass – they are weightless.,sholvoir;gre;exam;core,
hash,hæʃ,n  杂乱， 混乱； 杂烩菜,,,sholvoir;gre;exam;core,
homage,'hɑmɪdʒ,n  效忠； 敬意,something you do to show respect for someone or something you think is important,The film pays homage to Martin Scorsese’s ‘Mean Streets’.,sholvoir;gre;exam;core,
pine,paɪn,v  憔悴； 渴望; n 松树,"If you pine for something, you want it very much, especially when it is unlikely that you will be able to have it; a tall tree with long hard sharp leaves that do not fall off in winter",I pine for the countryside.,sholvoir;gre;exam;core,
stagger,'stægɚ,v  蹒跚， 摇晃,"to walk or move unsteadily, almost falling over",He managed to stagger home.,sholvoir;gre;exam;core,
enliven,ɪn'laɪvən,v  使…更活跃或更愉快,to make something more interesting,Humour can help enliven a dull subject.,sholvoir;gre;exam;core,
syndrome,'sɪndrəm,n  综合症,an illness which consists of a set of physical or mental problems – often used in the name of illnesses,people who suffer from irritable bowel syndrome,sholvoir;gre;exam;core,
fraternity,frə'tɝnəti,n  同行； 友爱,Fraternity refers to friendship and support between people who feel they are closely linked to each other,Bob needs the fraternity of others who share his mission.,sholvoir;gre;exam;core,
redundancy,rɪ'dʌndənsi,n  多余， 累赘； 裁员； 人浮于事,"a situation in which someone has to leave their job, because they are no longer needed",The closure of the export department resulted in over 100 redundancies.,sholvoir;gre;exam;core,
rote,rot,n  死记硬背,"when you learn something by repeating it many times, without thinking about it carefully or without understanding it","In old-fashioned schools, much learning was by rote .",sholvoir;gre;exam;core,
forfeiture,'fɔrfətʃɚ,n  丧失,when someone has their property or money officially taken away because they have broken a law or rule,Refusal to sign meant forfeiture of property and exile.,sholvoir;gre;exam;core,
jagged,'dʒæɡɪd,adj  锯齿状的， 参差不齐的,having a rough or pointed edge or surface,the broken bottle’s jagged edge,sholvoir;gre;exam;core,
harmonic,hɑr'mɑnɪk,adj  和声的； 和谐的,relating to the way notes are played or sung together to give a pleasing sound,harmonic scales,sholvoir;gre;exam;core,
toy,tɔɪ,v  不认真地对待， 玩弄,,,sholvoir;gre;exam;core,
beholden,bɪ'holdən,adj  因受恩惠而心存感激，感谢；欠人情,"If you are beholden to someone, you are in debt to them in some way or you feel that you have a duty to them because they have helped you",We feel really beholden to them for what they've done.,sholvoir;gre;exam;core,
impoverish,ɪm'pɑvərɪʃ,v  使贫穷,to make someone very poor,Falling coffee prices have impoverished many developing economies.,sholvoir;gre;exam;core,
hallowed,'hælod,adj  神圣的,holy or made holy by religious practices,The bones will be buried in hallowed ground.,sholvoir;gre;exam;core,
whirlpool,'wɝlpul,n  旋涡,a powerful current of water that spins around and can pull things down into it,people who are caught in a whirlpool of grief,sholvoir;gre;exam;core,
intellectual,",ɪntə'lɛktʃuəl",adj 智力的；理性的; n  知识分子,"relating to the ability to understand things and think intelligently; an intelligent, well-educated person who spends time thinking about complicated ideas and discussing them",Mark’s very intellectual.,sholvoir;gre;exam;core,
reclaim,rɪ'klem,v  纠正， 改造； 开垦,"to make an area of desert, wet land etc suitable for farming or building",This land will be reclaimed for a new airport.,sholvoir;gre;exam;core,
interchangeable,",ɪntɚ'tʃendʒəbl",adj  可互换的,things that are interchangeable can be used instead of each other,These two words are almost interchangeable.,sholvoir;gre;exam;core,
allegory,'æləɡɔri,n  寓言,"a story, painting etc in which the events and characters represent ideas or teach a moral lesson",The poem's comic allegory was transparent.,sholvoir;gre;exam;core,
sarcastic,sɑr'kæstɪk,adj  讽刺的,"saying things that are the opposite of what you mean, in order to make an unkind joke or to show that you are annoyed",Was she being sarcastic?,sholvoir;gre;exam;core,
interchangeably,ɪntɚ'tʃendʒəbli,adv  可互换地,,"Despite the apparent clarity around the distinct origins and meaning of the caduceus and the staff of aesculapius, they are both used commonly, and of ten interchangeably, every day.",sholvoir;gre;exam;core,
